{
  "$schema": "./nx-eskd-profile.schema.json",
  "schemaVersion": "1.0.0",
  "documentType": "nx-eskd-drawing-generation-profile",
  "profileId": "RU_ESKD_NX2512_FULL_EXAMPLE",
  "profileName": "Полный профиль автоматического формирования чертежей ЕСКД в Siemens NX",
  "profileStatus": "example",
  "targetEnvironment": {
    "_description": "Ограничения совместимости. Плагин обязан проверить их до изменения модели.",
    "nxProduct": "Siemens NX / Designcenter NX",
    "nxRelease": "2512",
    "nxOpenLanguage": "CSharp",
    "units": "millimeter",
    "locale": "ru-RU",
    "decimalSeparator": ",",
    "drawingStandard": "ESKD",
    "projectionMethod": "first_angle",
    "managedMode": "native_nx",
    "teamcenterMode": "optional"
  },
  "documentation": {
    "_description": "Самодокументирующая часть. Не влияет на построение, но используется UI, справкой и генератором документации.",
    "purpose": [
      "Выбрать формат, ориентацию, рамку и шаблон листа.",
      "Создать и заполнить основную надпись и дополнительные графы.",
      "Настроить шрифты, линии, размеры, допуски, шероховатость и штриховку.",
      "Создать виды, разрезы, сечения, выносные и разорванные виды.",
      "Перенести PMI из 3D-модели в чертеж и автоматически разложить аннотации.",
      "Создать спецификацию, позиции, таблицы и технические требования.",
      "Сформировать и оформить развертку листового металла.",
      "Проверить чертеж по формализованным правилам ЕСКД.",
      "Повторно обновлять автоматически созданные объекты без дублирования."
    ],
    "controlledObjectCatalog": [
      {
        "id": "sheets",
        "managed": "Листы чертежа",
        "controls": [
          "количество и порядок листов",
          "формат и ориентация",
          "масштаб листа",
          "название и номер",
          "создание дополнительных листов при переполнении",
          "применение шаблона PRT"
        ]
      },
      {
        "id": "borders",
        "managed": "Рамки, зоны и координатная сетка",
        "controls": [
          "отступы рамки",
          "зоны по сторонам листа",
          "буквенно-цифровые обозначения зон",
          "центровочные метки",
          "обрезные метки",
          "служебные области, запрещенные для размещения видов"
        ]
      },
      {
        "id": "titleBlocks",
        "managed": "Основные надписи, дополнительные графы и таблицы изменений",
        "controls": [
          "выбор формы штампа",
          "поиск ячеек по стабильным меткам",
          "источники данных",
          "форматирование значений",
          "обязательность полей",
          "синхронизация с атрибутами NX и Teamcenter"
        ]
      },
      {
        "id": "draftingStyles",
        "managed": "Стили оформления",
        "controls": [
          "шрифты и высоты текста",
          "линии и толщины",
          "стрелки и засечки",
          "размеры и точность",
          "геометрические допуски",
          "шероховатость",
          "обозначения сварки",
          "штриховка",
          "центровые линии и метки"
        ]
      },
      {
        "id": "views",
        "managed": "Чертежные виды",
        "controls": [
          "главный и проекционные виды",
          "изометрия",
          "разрезы и сечения",
          "выносные виды",
          "разорванные виды",
          "обрезка и границы",
          "скрытые линии",
          "видимость слоев и компонентов",
          "масштаб и размещение"
        ]
      },
      {
        "id": "pmi",
        "managed": "Перенос PMI",
        "controls": [
          "выбор модельных видов и групп PMI",
          "типы переносимых объектов",
          "ассоциативность",
          "дедупликация",
          "распределение по чертежным видам",
          "автоматическое размещение",
          "перенос PMI развертки"
        ]
      },
      {
        "id": "partsLists",
        "managed": "Спецификации и позиции",
        "controls": [
          "структура BOM",
          "уровни сборки",
          "объединение одинаковых компонентов",
          "колонки и сортировка",
          "позиции и выноски",
          "синхронизация с составом сборки"
        ]
      },
      {
        "id": "flatPatterns",
        "managed": "Развертки листового металла",
        "controls": [
          "создание или выбор Flat Pattern",
          "ориентация",
          "показ линий сгиба",
          "направление сгибов",
          "показ технологических элементов",
          "перенос Flat Pattern PMI",
          "габариты заготовки",
          "таблица гибов",
          "экспорт DXF"
        ]
      },
      {
        "id": "validation",
        "managed": "Автоматическая проверка",
        "controls": [
          "выход за рамку",
          "пересечения",
          "пустые поля",
          "устаревшие виды",
          "повторные размеры",
          "неверный масштаб",
          "ошибки позиций",
          "неразрешенные ручные подмены"
        ]
      }
    ],
    "importantImplementationNotes": [
      "JSON не должен хранить временные NX Tag как постоянные идентификаторы.",
      "Объекты следует искать по имени, атрибуту, типу, группе PMI или логическому managedId.",
      "Геометрию рамки и штампа предпочтительно хранить в нативных PRT-шаблонах.",
      "Плагин должен изменять только объекты с признаком AUTO_DWG_MANAGED=true.",
      "Инженерные значения допусков, шероховатости и материалов нельзя придумывать по геометрии.",
      "Все операции генерации должны выполняться в одной откатываемой транзакции NX Undo."
    ]
  },
  "standardsProfile": {
    "_description": "Нормативные ссылки и внутренние профили. Перед промышленным выпуском редакции стандартов сверяются с локальной нормативной базой предприятия.",
    "country": "RU",
    "system": "ESKD",
    "standards": [
      {
        "code": "ГОСТ Р 2.104-2023",
        "area": "основные надписи"
      },
      {
        "code": "ГОСТ Р 2.109-2023",
        "area": "основные требования к чертежам"
      },
      {
        "code": "ГОСТ 2.301-68",
        "area": "форматы"
      },
      {
        "code": "ГОСТ 2.302-68",
        "area": "масштабы"
      },
      {
        "code": "ГОСТ 2.303-68",
        "area": "линии"
      },
      {
        "code": "ГОСТ 2.304-81",
        "area": "чертежные шрифты"
      },
      {
        "code": "ГОСТ 2.305-2008",
        "area": "виды, разрезы и сечения"
      },
      {
        "code": "ГОСТ 2.306-68",
        "area": "штриховка"
      },
      {
        "code": "ГОСТ 2.307-2011",
        "area": "размеры и предельные отклонения"
      },
      {
        "code": "ГОСТ Р 2.308-2023",
        "area": "геометрические допуски"
      },
      {
        "code": "ГОСТ 2.309-73",
        "area": "шероховатость"
      },
      {
        "code": "ГОСТ 2.310-2022",
        "area": "покрытия и обработка"
      },
      {
        "code": "ГОСТ 2.311-68",
        "area": "резьбы"
      },
      {
        "code": "ГОСТ 2.312-72",
        "area": "сварные соединения"
      },
      {
        "code": "ГОСТ Р 2.316-2023",
        "area": "надписи, технические требования и таблицы"
      },
      {
        "code": "ГОСТ Р 2.051-2023",
        "area": "электронные конструкторские документы"
      }
    ],
    "companyStandards": [
      {
        "id": "STO_DRAFTING_001",
        "name": "Корпоративный профиль оформления NX",
        "revision": "A",
        "required": false
      }
    ],
    "ruleSeverity": {
      "ERROR": "Запрещает выпуск и сохранение в статус Released.",
      "WARNING": "Разрешает генерацию, но требует просмотра.",
      "MANUAL_REVIEW": "Решение должен подтвердить конструктор.",
      "INFO": "Информационное сообщение.",
      "AUTOFIX": "Нарушение может быть исправлено автоматически."
    }
  },
  "paths": {
    "_description": "Пути разрешаются относительно каталога профиля, переменных окружения или централизованного каталога.",
    "rootVariable": "NX_ESKD_ROOT",
    "templates": "${NX_ESKD_ROOT}/templates",
    "symbols": "${NX_ESKD_ROOT}/symbols",
    "fonts": "${NX_ESKD_ROOT}/fonts",
    "rules": "${NX_ESKD_ROOT}/rules",
    "exports": "${PART_DIR}/exports",
    "reports": "${PART_DIR}/reports",
    "logs": "${LOCAL_APP_DATA}/NxEskdGenerator/logs",
    "pathResolutionOrder": [
      "absolute_path",
      "profile_relative",
      "environment_variable",
      "nx_customer_defaults",
      "fallback"
    ],
    "missingPathPolicy": "error"
  },
  "execution": {
    "_description": "Общее поведение плагина.",
    "mode": "create_or_update",
    "strictMode": true,
    "dryRun": false,
    "previewBeforeCommit": true,
    "singleUndoTransaction": true,
    "rollbackOnError": true,
    "saveOnlyWhenValid": true,
    "preserveManualObjects": true,
    "preserveManualViewPositions": false,
    "preserveManualDimensions": true,
    "preserveManualNotes": true,
    "allowUnknownJsonProperties": false,
    "idempotency": {
      "enabled": true,
      "managedAttribute": "AUTO_DWG_MANAGED",
      "managedIdAttribute": "AUTO_DWG_ID",
      "profileIdAttribute": "AUTO_DWG_PROFILE_ID",
      "configHashAttribute": "AUTO_DWG_CONFIG_HASH",
      "generatorVersionAttribute": "AUTO_DWG_GENERATOR_VERSION",
      "deleteManagedObjectsMissingFromConfig": true,
      "neverDeleteUnmanagedObjects": true
    },
    "updateSequence": [
      "validate_input",
      "resolve_values",
      "analyze_model",
      "build_drawing_plan",
      "set_undo_mark",
      "create_or_update_sheets",
      "create_or_update_views",
      "inherit_pmi",
      "create_dimensions_and_annotations",
      "create_tables_and_parts_lists",
      "layout_objects",
      "update_all_views",
      "validate_result",
      "save",
      "export",
      "write_report"
    ]
  },
  "valueResolution": {
    "_description": "Единая система получения значений для штампов, таблиц и примечаний.",
    "precedence": [
      "job_override",
      "json_profile",
      "teamcenter_property",
      "nx_part_attribute",